{"$schema":"https://ontology-dashboard.local/schemas/system-rebuild-job-request.schema.json","job_type":"mapping_rebuild","mapping_id":"sensor-protocol-mapping","mapping_version":"2.0.0","mapping_sha256":"1111111111111111111111111111111111111111111111111111111111111111","source_uri":"gen_data/site-a/cell-01/sensor.log","replay_scope":"full_source","flush_before":null,"max_records":null,"activate_on_success":true,"idempotency_key":"mapping-rebuild-site-a-v2","reason":"Mapping v2 적용 검증 및 재추출"}
